序号,上级评论ID,评论ID,用户ID,用户名,用户等级,性别,评论内容,评论时间,回复数,点赞数,个性签名,IP属地,是否是大会员,头像
91,0,258169677921,291370784,水饺爱吃狗,5,男,作为一个千场绝密1.9KD过来人的经验，绝密要考虑的要素太多了，数都数不过来，一些人只知道满5套红修满M14进场，却不知道战损，你一场吃了400万，损失100万，收益300万卖一卖到手也就250万，但是你但凡死一场，一场就是200万，所以你起全装要保证一直赢。但是机密就不一样了，一套修脚＋破烂3甲全部加起来20万随便摸两个金就有保底，稳稳的赚钱。我有一个朋友在机密起4弹M14我已经崩溃了，还没事儿说自己破产了。,2025-03-29 08:23:28,0,3,若之离我远点，求你了。,未知,是,https://i2.hdslb.com/bfs/face/48d27a413e34c7881d0045d4122ef6def94d4f9d.jpg
92,0,258169430433,3546826034645179,nano二世,2,保密,这游戏本来不就是赚钱拿来花的吗，三角洲的设计很明显就是为了打架去服务的，大家跑完刀就去战斗爽，哈夫币整体总量下去了，那不就又能跑刀摸大红，又能航天战斗爽了吗？,2025-03-29 08:19:54,0,0,,未知,否,https://i1.hdslb.com/bfs/face/e221439c4fcd39503c855e6d5c18819a496c9b81.jpg
93,0,258165416049,3493105831512662,三角洲破产王,5,保密,虽然我经常打绝密，但是我还没有入迷啊，平常有钱就打打绝密，没钱就打打普通,2025-03-29 07:20:38,0,0,,未知,否,https://i2.hdslb.com/bfs/face/0bdd96ce5d325548d6c470a1c2713666cb29343c.jpg
94,0,258983312432,282181107,飞翔的澳大利亚人,5,男,用dma,2025-03-29 06:05:20,0,0,你说的这话你自己相信吗？,未知,否,https://i0.hdslb.com/bfs/face/5ab200a64434ebf3663d731d86fd9a4e90d7824b.jpg
95,0,258957585888,3546382424082706,彡南国烟雨彡,4,保密,染上绝密了，号里现金不多了，但资产没变[滑稽],2025-03-29 00:12:16,0,0,,未知,否,https://i1.hdslb.com/bfs/face/fb3b0c767af785f0ff16719f8d5a45db1dfe03fc.jpg
96,0,258954240576,3546679858957143,霉名_,3,男,我玩儿了三个赛季的大战场，赚了5000万哈弗币。,2025-03-28 21:48:41,0,0,"本人的梦想是粉丝破200，当一个主播
还有本人什么游戏都玩(当然除了蛋仔派对)",未知,否,https://i0.hdslb.com/bfs/face/2bc9b8d0dc29e8d05cabc98e0b4d2c8d92f862c1.jpg
97,0,258947388704,520035136,bili_68588500242,5,男,今天堵桥遇到个复苏呼吸机，一个老鼠偷偷藏起来的，一个队友把他杀了，就直接撤离了，然后另一个队友眼瞎，没看见，我把他一拿我就走了[doge_金箍],2025-03-28 17:11:44,0,0,,未知,否,https://i0.hdslb.com/bfs/face/member/noface.jpg
98,0,258938320016,504196522,竹鼠吃竹子牛脾,4,保密,我刚玩三角洲啊 一开始的时候我不懂 然后呢就捡到好东西就卖钱 然后攒了一两百万当时还很懵懂 然后呢我就只打普坝，然后每次配东西大概就配在40多万 然后呢 我朋友有一天跟我玩 然后告诉我 ，你虎逼呀 ，打普坝，用套装券不就行了 ，然后才知道我带东西有点太多了,2025-03-28 15:07:04,0,0,,未知,否,https://i0.hdslb.com/bfs/face/member/noface.jpg
99,0,258111443345,3546709414119751,穿破云雾,3,保密,我航天第一把就让人机给打死了[笑哭],2025-03-28 14:04:29,0,0,,未知,否,https://i1.hdslb.com/bfs/face/d0797d13bb4ddcc91c46be6ba54d93d92d700ea0.jpg
100,0,258929512592,3546718347987440,花越花落,4,女,最开始打机密航天都特别心疼，现在绝密随便打，只能说有钱就内啥,2025-03-28 13:32:13,0,0,三角洲待哒+v：wxid_2epbjh1izs2f12,未知,否,https://i2.hdslb.com/bfs/face/6c540e85cc129158d5e7b9cde4969b6997fb5cd6.jpg
101,0,258929065792,1891917814,真特立迦奥特曼,4,男,玩两把没一次出来再玩我就是狗,2025-03-28 13:26:28,0,0,,未知,否,https://i1.hdslb.com/bfs/face/73f00a200c5f779f657d12526efaa284e331559b.jpg
102,0,258925974976,2049132391,凌曦晨丶,4,男,@杨起家,2025-03-28 12:53:26,0,0,三角洲，共创世界，我的世界网易版，均可见到我的身影,未知,否,https://i1.hdslb.com/bfs/face/786884b730ca6d11de1bfaf9fefd34eb712b9c18.jpg
103,0,258925550784,162902635,艾尔艾爾,6,男,玩绝密航天就跟赌博一样，普通玩家是以身入局，一旦输了就是倾家荡产，但是主播和天才少年就不一样了，他们是做局者，天天剪辑绝密航天视频引诱你入局,2025-03-28 12:48:28,0,1,人吃人,未知,否,https://i1.hdslb.com/bfs/face/9957e81575378335224075e1a3491ebe3c21697f.jpg
104,0,258103438721,3493130961685353,我不是归来,3,男,大坝的话，我一般也是80万撤离的,2025-03-28 12:35:27,0,0,不如人机,未知,否,https://i0.hdslb.com/bfs/face/7265144b416d97a112eadb62cdfb171a9ec71d37.jpg
105,0,258913248384,1061471410,六浦六,5,保密,我一哥们已经这样了，不开玩笑[微笑],2025-03-28 10:30:29,0,0,,未知,否,https://i1.hdslb.com/bfs/face/13d52454f23b69ccb6aed1f1e45a82fc5df93801.jpg
106,0,258089610049,626979884,凭实力无名,5,男,"选择你的模式
1，逃离塔科夫
2，战地
3，没下过",2025-03-28 09:50:37,0,0,我连自己名字都是敏感词汇，呜呜呜,未知,否,https://i2.hdslb.com/bfs/face/f58364d1bf8b3e52f194202111cde91ae6a9a274.jpg
107,0,258906337136,480345703,子非鱼于渔,5,保密,我跟我朋友刚玩的时候牛角都要一人分一个[doge],2025-03-28 09:05:10,0,0,,未知,否,https://i1.hdslb.com/bfs/face/b75159edbe8eac2cfc8e5f51ec0b8ff8ee0a4266.jpg
108,0,258081985825,3546385204906359,明天去看看吖,3,保密,我一般是在普坝跑刀跑两把，再去绝密,2025-03-28 08:03:04,0,0,,未知,否,https://i0.hdslb.com/bfs/face/9e57e07853904511d28024923efede65c0a50828.jpg
109,0,258079768353,8250381,芜音音音音,6,保密,太真实了,2025-03-28 07:26:14,0,0,,未知,是,https://i0.hdslb.com/bfs/face/c75826fb2b742f4d2d97ff3948df492581a2b1f9.jpg
110,0,258079616769,628083792,-殇弑栀殓-,5,男,我可以接受朋友和我一起打绝密破产，但是你攒钱是为了坐牢而不是为了和朋友玩的快乐那我们不熟[微笑],2025-03-28 07:23:43,0,1,各处是此名,未知,否,https://i0.hdslb.com/bfs/face/9564cabc4708758d2b86536446a0057fa75182a5.jpg
