序号,上级评论ID,评论ID,用户ID,用户名,用户等级,性别,评论内容,评论时间,回复数,点赞数,个性签名,IP属地,是否是大会员,头像
1,0,261115705265,182409866,铃音-依梦,6,男,喜欢终夜吗[呲牙],2025-05-05 01:45:24,0,0,,未知,是,https://i2.hdslb.com/bfs/face/94d5c6371685ca2e36b63c48782f0c976766ff88.jpg
2,0,261110904241,1837670164,bili_24169845639,2,保密,其实普坝跑刀很稳的，带个紫包一把七八十没问题，运气好的话百万,2025-05-05 00:13:26,0,0,,未知,否,https://i1.hdslb.com/bfs/face/ea59332d3a455b757045eead2a923bc0578fcf93.jpg
3,0,260870808529,7655571,賽博可愛小佞臣,6,保密,[doge_金箍]我带个红甲修给朋友用[doge_金箍]120发紫色子弹，300发蓝色[doge_金箍]朋友就是我的护航,2025-05-02 05:27:20,0,0,服赛博兵役，打虚拟二战，当电子媚魔，享完美人生,未知,是,https://i0.hdslb.com/bfs/face/5f7bcc59cfbc855bdbc53e39e063b1ebb27817cf.jpg
4,0,261646738832,2168018,fggf40152,5,保密,带个红甲修谢谢绷不住了，我一个朋友也是，他猛攻，没甲了，找我要甲修，我丢了个紫的。他说这紫甲修我一拿出来他整个人都不好了。。不是哥们我寻思着你起不了红甲修还要起紫甲的兄弟帮你带呗。。非得起6套。。开局还不提前商量要队友带甲修进去。,2025-04-30 09:00:31,0,0,,未知,否,http://i2.hdslb.com/bfs/face/edbb985d10e488bc4fd2a311c4436d27f406d249.jpg
5,0,261545394368,3493263807875788,江潮道长,4,男,加油看好你,2025-04-29 03:41:28,0,0,抱朴守拙,未知,否,https://i1.hdslb.com/bfs/face/cc9523496a2bdc29c2478b9519378169603b1f4b.jpg
6,0,261315813104,533026409,S2整活大尸队长,5,男,绝密单三人：跟我的金弹说去吧！我还有！最后一舞！,2025-04-26 05:39:12,0,0,三角洲行动up主，性格温和，为人正直（摆烂）兼顾蔚蓝档案，明日方舟等游戏视频，希望各位支持一下咯~粉丝群:657365246（q）,未知,否,https://i2.hdslb.com/bfs/face/685715665a87d5b5f0a42fa9e58a5a40d9021c0a.jpg
7,0,261294391120,594361537,萧慕戮,4,保密,连败吃经济啊,2025-04-26 00:45:32,0,0,,未知,否,https://i1.hdslb.com/bfs/face/90a7f6398ea5b1a5cc6b998723ef015ac31e5f55.jpg
8,0,261029274624,3493291077142770,一定要刪除,4,保密,UP主加油！看好你噢~,2025-04-22 13:04:24,0,0,,未知,否,https://i0.hdslb.com/bfs/face/298f1ca61b086682987e3a1262e8dc059154fe48.jpg
9,0,259865685665,1452534666,-赤忱--,5,保密,确实如此，s2开始之后一直巴克，后面s3尝试一把就基天.....（第一次正式打航天赚到的[笑哭]）,2025-04-19 09:15:33,0,0,烟火人间，风味长存,未知,否,https://i0.hdslb.com/bfs/face/1838726375f3da698fc7292a05abf4f6a27e3ca1.jpg
10,0,259858371569,161268891,hirazimi,6,男,现在红甲修53w，瞪羚才43w[doge],2025-04-19 07:29:02,4,0,要写什么好呢... 看看得了,未知,否,https://i0.hdslb.com/bfs/face/e315d1587f443272210dfe7fba9f4721f0f3b249.jpg
11,0,259760212337,352164462,七霜star,6,男,我是你朋友我会说：哥们，试试M250，这个劲大[doge],2025-04-18 03:16:00,0,0,英语你该死啊O(▼皿▼#)O,未知,是,https://i0.hdslb.com/bfs/face/80487300e4f6f338a60f4e052db272c3b4e5a2c4.jpg
12,0,259747701745,3718556,无火の余灰1,6,男,机坝打底一百万左右,2025-04-17 22:20:04,0,0,,未知,否,http://i2.hdslb.com/bfs/face/3df8323748ca8b09e82909c02d0438cf17218ded.jpg
13,0,259654664929,1440022793,不看番的b站人,5,保密,一个月500不能吧，就上个月跟固排打了半个月把我6000多万打光了，单三就跑了几周的长弓，可能连一个月都没到，现在现金已经过亿了[藏狐],2025-04-16 13:49:27,0,2,,未知,否,https://i2.hdslb.com/bfs/face/c62702112aa3fe9da991ca1db5382cd9f5f5efd2.jpg
14,0,259645281377,3493129512552666,九明老师呀,4,男,刚打赚了300多万，后面打了几把，1200万掉到600万，再也没打绝密了,2025-04-16 11:47:32,0,0,当萌新+女装大佬+老六+泽圣，三连！投币！,未知,是,https://i0.hdslb.com/bfs/face/f7014deb346b8b7a34bbaa9d227ae0389004b8c6.jpg
15,0,260474917840,410694404,寂静城镇,5,男,不知道我那一背包一颗不重样的5鸡蛋和蜡笔键盘鼠标蜡笔好吃吗[滑稽],2025-04-15 17:59:46,0,0,,未知,否,https://i2.hdslb.com/bfs/face/3406bfafbd88ee942c53b0cc86a073c9fcc1b635.jpg
16,0,260344751600,361390001,曹觥氹,5,保密,红甲修?我都是直接要六套的,2025-04-14 04:41:50,0,0,,未知,否,https://i2.hdslb.com/bfs/face/dc1b7f63d2baabc967c19a5b78b4a13fa05a3679.jpg
17,0,259465218097,14045165,搂导,6,男,我朋友也喜欢猛攻。好劝歹劝拖去普坝打了一把。。得。他在医务室出复苏呼吸机了。。我的呢！？,2025-04-14 03:49:07,0,0,,未知,否,https://i2.hdslb.com/bfs/face/0b43f7cbb4e21030f7e5ca1c83f9a2e1e1eb3eba.jpg
18,0,259454970321,21744177,脑子君10086,6,男,超绝低kd绝密巴克什跑刀[doge]，爽吃,2025-04-14 00:26:35,0,0,不要陷入仇恨的漩涡,未知,是,https://i0.hdslb.com/bfs/face/1b1ed539f3adcf8fb3be42f3bcb6652416406791.jpg
19,0,259327617841,110648189,刘玥亡命峰哥,6,男,最开始就是因为卡油玩航天，出了油之后已经是航天的形状了，别的图都玩不下去。缺钱就在航天跑刀赚钱，有钱就在航天猛攻。我固排最开始卡锅卡油玩航天，当时也是觉得航天很屎，出了油就不玩航天了，现在天天跟我一起猛攻航天了。,2025-04-12 10:13:47,1,0,.,未知,否,https://i2.hdslb.com/bfs/face/cc660516a9a08ff98d4a85ca4b2603bb640c617c.jpg
20,0,259286947345,12059874,静谧赛高,6,男,笑嘻了，一个搜了半天价值不出金红全是紫还没杀一个人的装备值钱的游戏,2025-04-12 00:28:45,0,0,没了咯  ol没得玩了,未知,否,https://i0.hdslb.com/bfs/face/0f3833381039c3991cc55ccc701bfc68058c8704.jpg
26,0,260076832096,3461573611882521,昵称够长才不重复,5,保密,"只打机密长弓，根本想象不到怎么破产，赚损比很难下1.5m，撤离率基本稳定60[doge]
第一张是我刚玩三四天的小号[doge]",2025-04-11 02:08:55,0,0,,未知,是,https://i0.hdslb.com/bfs/face/5aaea6f2a193f8b0ae77ef10546a1a7d7d673c0a.jpg
27,0,260023727808,108094221,克-维,5,男,绝密还是巴克什好，至少不会一队堵桥，所以撤离点都过不去[微笑][思考],2025-04-10 09:02:26,0,0,用柔软的内心，迎接世界的温暖,未知,否,https://i0.hdslb.com/bfs/face/62a24dda696434eb204b80403a329ffe43c59327.jpg
28,0,259962464368,399460716,悠然yasuo,5,男,@要努力生活鸭鸭,2025-04-09 13:16:24,1,0,心夏单推人|亚索绝活|青水之神,未知,否,https://i0.hdslb.com/bfs/face/e40e5f881b6c94c481f1563550ae79903ce07020.jpg
29,0,259908338672,8910836,JasonDragon-xx,6,男,"很幸运看来是染不上来了，顶天跟大佬一块灭队清航天4个楼 出来也就200w出头，但战损....考虑带进入还有6套5头等等，跟人刚枪压力，子弹损耗，真不如单三跑刀，所以绝密全装作战纯纯作为偶尔富了的消遣摆了。
很多时候爆大红都不是全装打出来的，就是惊鸿一瞥",2025-04-08 23:12:19,0,0,摸了，摸了,未知,否,https://i2.hdslb.com/bfs/face/b1f4ba1ffbadfa19a9f801e213b178d1dc6518e6.jpg
30,0,259042990385,381724088,果断去白给,5,保密,因为火箭燃油去打绝密航天，排到大哥吃垃圾，各种枪械装备加起来有近六百万（打到后面身上没一个是带进来的装备），后面和朋友回机坝快清图也不到一百五十万我就知道回不去了[大哭],2025-04-08 17:10:23,0,0,……,未知,否,https://i2.hdslb.com/bfs/face/6c950bf5d81834e817bb0867aa3c494f362f5078.jpg
31,0,259891490784,3493092371991015,全服第1加面王,4,男,"所有的鼠鼠都怕染上一种病，猛攻病……
染上这种病的鼠鼠会忽然去玩巴克什的或者航天这种高爆率低撤离的地图，但是这些地图都存在着很多的“猫”会捕食他们，就这样一直循环下去。最终，这些染上病的鼠鼠会发疯似的卖掉自己仓库中的所有物品，嘴里一遍遍重复着“猛攻，猛攻，猛攻……”最终死亡（退游）",2025-04-08 14:57:37,1,9,不知道写什么,未知,否,https://i0.hdslb.com/bfs/face/118ad9a9540a3376611f3082ed6a0069a50d4734.jpg
32,0,259014582561,57913287,嘉年告罄,6,男,PC找固排，刚玩一个多月，经济学跑刀大坝，长工都会，机密绝密长工，巴克什，航天一直单三玩的，都是卡战备跑刀，最近想找固排，八宝粥野排太痛苦，地图跑刀经营都看视频学习了，类似巴别塔与博物馆没咋进过，非常希望有人一起玩，这样才不会被路边一脚踹死，是屯屯鼠，仓库屯有装备与红，脾气好，脾气太急躁的老哥求放过，红可以商量分配，搜到过不少红，只是想收集红，重复的可以优先给你，kd太高的高手不必来，谢谢。因一直跑刀kd很低，有fps经验，csgo-b段，能开麦交流，听指挥，绝不cs，会蜂医（大坝跑刀学习），麦小鼠（巴克什学习），威龙（长工跑刀学习），红狼（有皮肤却没咋玩一直跑刀），之前大佬带过打过几次战斗，战斗经验不多，大战场也玩玩不多，月底上班之后，只能晚上和周末打，现在基本没事，时间自由。希望有脾气好，愿意沟通，合理分配的一搜打撤。+vx wk1356929[doge_金箍],2025-04-08 10:57:21,0,0,逗比话痨,未知,是,https://i0.hdslb.com/bfs/face/9fadc8ea60042c3f681521f9bfbae8fa6f4db257.jpg
33,0,259862525040,3546765343066311,_胆小慎入_规则怪谈_,2,保密,UP主加油！看好你噢~,2025-04-08 09:01:19,0,0,,未知,否,https://i0.hdslb.com/bfs/face/4f04d0837205d8373b2685cb44018182df6ee355.jpg
34,0,258950474961,11796173,HTT中野梓,6,保密,染上绝密了[大哭]但是鼠鼠好吃😋,2025-04-07 13:57:17,0,0,"点击查看签名
































                      好了可以合上了 乖",未知,是,https://i2.hdslb.com/bfs/face/1dff6856b21100b611e131764edb39df638a291b.webp
35,0,258916419089,295307658,红之爱丽丝,6,保密,打屁绝密，直接单刀入局普通，怎么打都不亏[doge],2025-04-07 05:46:10,0,0,,未知,是,https://i0.hdslb.com/bfs/face/3bd479fcd15490f8186da8387c61842c08f435ef.jpg
36,0,258892012113,192565492,mysilentnight,6,保密,绝密只打巴克什，闸宽松，路线多样化，博士撤离还有超强鸡哥护航，只有0.7kd的我一样在绝密赚了钱[doge_金箍]再菜选个佐娅就不算毫无贡献。,2025-04-06 19:00:53,0,0,1w采购币就是不出G41live2d的我已经不想写简介了,未知,是,https://i1.hdslb.com/bfs/face/78d51f17bf824296aa8337c99b75233cea8c9529.jpg
37,0,258850363105,2681376,夜神汐音,6,保密,普坝根本没有人机，都是满编队。落地50S我还以为自己进机密了,2025-04-06 09:01:40,0,0,,未知,是,http://i0.hdslb.com/bfs/face/505650fe4fa6391be485250ae806922b0adcc9f1.jpg
38,0,258836034177,86098869,沙漠中唯一的城堡,6,保密,绝密，牢区出的，油没带出来，不过我藏起来了,2025-04-06 05:43:02,0,0,,未知,是,http://i2.hdslb.com/bfs/face/b63461b4fb8979ad98dc6ad22cc84429c1551f85.jpg
39,0,258827572449,1985987,国家特级撸猫技师,6,保密,0杀吃490万。。。食尸鬼大胜利啊，而我昨天单三绝密踢死了四只最后一秒烟没封好在撤离点被抽了，好难受[大哭],2025-04-06 04:01:54,0,0,随机发布涩铯的画，动态无了就是被逮捕了Ciallo～(∠・ω＜)⌒,未知,是,https://i2.hdslb.com/bfs/face/7b5d8a37c2688c90efc41cf256c8684d70e39fd8.jpg
40,0,259671630848,2083840030,鲁喽鸭脖吼波速干,5,保密,我带着机密缴的勇士  在路口蹲了15分钟偷掉一个人直接夺舍  望周知,2025-04-06 02:49:49,0,0,,未知,否,https://i1.hdslb.com/bfs/face/6e7ee177b5cc681b9609c07f8d5eb574b52d409c.jpg
41,0,258724974737,22863576,-禾语-,6,保密,现在打不了一点 普坝四套机密五套绝密就遍地六套了,2025-04-05 00:21:33,0,0,QWQ,未知,是,https://i0.hdslb.com/bfs/face/b01adfe9717e381c3f836f62d34c797e895544ab.jpg
42,0,259536720272,1448989904,绳网用户420102,5,保密,逆天普坝帮我把绝密戒了,2025-04-04 12:24:06,0,1,,未知,否,https://i2.hdslb.com/bfs/face/f474c7ef819c6d82e36ebd22e759dd2032fc2a9d.jpg
43,0,258666567025,184843254,如此该睡觉了,6,男,"借楼，正常跑刀，不自杀进黑屋
10r=100w哈夫币
90r=1000w哈夫币
3000w以上优惠
扫码上号，纯绿手搓，可开直播，需要的可以私聊
需要留金留红提前说明也接3*3任务",2025-04-04 06:58:17,0,0,需要加vx：juexiang714，qq：2732388611,未知,否,https://i0.hdslb.com/bfs/face/b8abe9afb5ad95997f3d90f2ebb89685631212f8.jpg
44,0,259508722848,30298421,哈夫克土兵,6,男,绝密航天跑刀我觉得比做那些哈啤部门任务强多了，连跑了十多天绝密航天的好心情被我一天的部门任务全耗光了。,2025-04-04 06:34:25,0,1,花Q,未知,是,https://i2.hdslb.com/bfs/face/bb90be91aa09b9b5bb704ae024374c48ee4c3d10.jpg
45,0,259505986992,1184922220,蒍為,5,保密,航天基地是根本不去的，巴克什是戒不掉的,2025-04-04 05:59:09,0,0,孩子们巴克什跑路王来,未知,否,https://i1.hdslb.com/bfs/face/592168e9020b3136b3191b590863a2f058b84106.jpg
48,0,259502511952,500582604,Fate6455,5,保密,还是玩机密吧，三弹或者四弹冲锋枪能夺舍5套就算得吃,2025-04-04 05:13:57,0,0,,未知,是,https://i0.hdslb.com/bfs/face/8617b7348252f018e84783fbe6f965b248456b01.jpg
49,0,259495453424,693613410,渔舟清水,5,男,绝密现在完全是搜不了，一直打[笑哭]你要是没狗运的话全装进靠摸根本赚不了多少，我之前绝密巴克什清完巴别塔飞鼠撤，就赚130万，亏损100万，绝密清图狠狠赚30万，笑嘻了,2025-04-04 03:48:30,0,0,i粥,未知,否,https://i0.hdslb.com/bfs/face/f312456498ad596b674b32f552f600af99c7d250.jpg
50,0,258648213905,20359575,抓不到鸟的猎人,6,保密,还以为打电话给杨起家(ಡωಡ),2025-04-04 02:55:21,0,0,很懒，什么都没留下～,未知,否,http://i0.hdslb.com/bfs/face/a92f5ee64d6259798f9e3a2b8bc2a4661f1c810a.jpg
51,0,259475373184,1356227545,雨中大爆发,5,保密,[doge],2025-04-03 19:49:14,0,0,记录我的游戏每一天,未知,是,https://i1.hdslb.com/bfs/face/22550e3e2bd14ffd3413777df0a7a763e816beaf.jpg
52,0,259427966960,30291128,Felix-D-Schultz,6,男,最后这句精髓了，一哥们也是这么干的，每次都是“帮我带个红修”“帮我带两组金弹”,2025-04-03 08:41:58,0,0,"新生
",未知,是,https://i2.hdslb.com/bfs/face/7c07a4b6aed1409cafa68cfc97800f2d47cfc1e3.jpg
53,0,259386516928,20688721,过-来-,6,保密,"只要坚持单三跑刀，绝密也是一天涨几百万资产的速度[doge_金箍]
就是用人机头甲和垃圾枪凑战备进去送",2025-04-02 18:24:45,0,0,,未知,是,https://i1.hdslb.com/bfs/face/6dc4ef365afb9db66bf8129b491f12400c8eb98b.jpg
54,0,258545515841,1642393278,暮城余辉,4,男,我就玩个乌鲁鲁带把狙等着对面拉闸，全家福在保险里,2025-04-02 17:25:42,0,0,,未知,否,https://i0.hdslb.com/bfs/face/850f1a9defebce22631fe714c4883f80c224b35f.jpg
55,0,258540607857,495940987,小希童鞋,5,保密,屁，劳资在大坝跑刀一天一千万,2025-04-02 16:06:14,0,0,,未知,否,https://i1.hdslb.com/bfs/face/92fc4bc0af714e8be023de6240d377811a9c1a4c.jpg
56,0,259322242080,1513001363,wggdvdc,5,男,55486158,2025-04-02 04:11:26,0,0,我是宇宙无敌贝利亚大王,未知,是,https://i2.hdslb.com/bfs/face/2b014ff1003005b1f87fe409887a6ffbfdf09dba.jpg
57,0,259284157872,105394038,城北岳公,6,男,"绝密跑刀 等护航主播啥的清完图吃个剩饭也能几百万 
平常就4套4蛋打机密大坝 只要水平正常 基本把把百万撤离 简单又得吃",2025-04-01 14:12:37,0,0,诶嘿嘿,未知,是,https://i0.hdslb.com/bfs/face/e1962e998525e39583a52396cfb6e0e438294941.jpg
58,0,258419692673,375799486,就是那个杰哥啊,5,保密,@不铭飞行物,2025-04-01 08:02:09,0,0,林深时鹿隐，海蓝时浪涌，梦醒时夜续,未知,否,https://i1.hdslb.com/bfs/face/cb43c72d0fd0bbc99a5219b26c57ac5dae4c143e.jpg
59,0,259250216464,3546579080317471,恐怖如斯的菜鸟,3,男,UP主加油！看好你噢~,2025-04-01 07:20:28,0,0,,未知,否,https://i1.hdslb.com/bfs/face/f8a75b8ccc42526fa1581838ac422e5497d033c9.jpg
60,0,258399830033,3392164,142181942,6,保密,打绝密掉了30m了[微笑],2025-04-01 03:20:31,0,0,"如果以后再也见不到你，祝你早安，午安，晚安。
",未知,否,https://i1.hdslb.com/bfs/face/6341f3bb698266c6674883015d75457adbe35a8a.jpg
61,0,258392099409,697126562,辉夜魔法师,5,保密,"j绝密不就是 博彩嘛 赢一局 就想更多 
然后后面就是输",2025-04-01 01:07:05,0,0,,未知,否,https://i2.hdslb.com/bfs/face/dfefa5509f72315769f896ec72ff1646ae354cb0.jpg
62,0,259184097104,1207652028,五等分的商革央-,5,男,UP主加油！看好你噢~,2025-03-31 11:35:24,0,0,,未知,否,https://i0.hdslb.com/bfs/face/5ef09c4a69bdd8196bca58fb247dad000fb5c920.jpg
63,0,259096568944,299586624,Kevin丶6,5,保密,说出来不怕被笑，我原来玩暗区的，三角洲刚玩的时候，发现一把大坝30w给我爽的，后面知道两游戏经济不一样就释然了[笑哭][笑哭][笑哭],2025-03-30 10:45:49,1,3,乐子人,未知,是,https://i0.hdslb.com/bfs/face/07cc049168ecb27d6b0c53a410c63b9905b7bce1.jpg
64,0,259095809232,1303109044,喜欢阿露的大连狙,4,保密,好朋友一枪没打吃我4个包赚了200多w下把必须带野牛进去抢包,2025-03-30 10:38:23,0,0,致敬传奇机器人肘击王:新春爱露,未知,否,https://i1.hdslb.com/bfs/face/ee76966b05611c228caf75e4840cb92923a3686d.jpg
65,0,258267680577,45521187,不如円申,6,保密,我是染上绝密跑刀了，三小时四个大红，爽的飞起,2025-03-30 10:26:23,2,13,这个人的成分很复杂,未知,否,https://i0.hdslb.com/bfs/face/e8900982190092da8d802e73370108aec7710354.jpg
66,0,258263657377,3494358842083956,十六夜咲夜_新号别搞,4,保密,人家绝密航天全是职业护航和透视锁头，爆出好东西了也有寻血猎犬闻着味就来了，你拿什么跟人家打…...,2025-03-30 09:38:32,0,0,,未知,否,https://i0.hdslb.com/bfs/face/8200906cfe055bf1a7df0f8e544513f6236f34be.jpg
67,0,258256871025,170024799,无毒无害亦心丸,6,女,三角洲这么好玩,2025-03-30 08:09:13,0,0,"漫威争锋国一女辅助，超努力进步中。粉丝群：784425967，直播回放在药中毒的录播播。v：HLoAv3siTcKE
",未知,是,https://i0.hdslb.com/bfs/face/0774059673bc323a219f497d00e7baeeedc649d8.jpg
71,0,258255527697,3546644347881882,BK1990小轮子,3,女,雷姆勒陪耗油打机密航天五个顶尖装备圈全浪费了。刚出生不到五分钟就没了,2025-03-30 07:47:55,0,0,,未知,否,https://i0.hdslb.com/bfs/face/3e9ae31ceb6f81feac6d75ffa32e75a84949ff6f.jpg
72,0,259077929360,384005200,易北河-,6,男,一模一样,2025-03-30 06:50:07,0,0,"故人不独亲其亲,不独子其子.使老有所终,壮有所用,幼有所长,鳏寡孤独废疾者,皆有所养。",未知,是,https://i1.hdslb.com/bfs/face/06c612232c0e0e311dd6491444dfb70d70801229.jpg
73,0,259077410736,451947810,煤溺态寄,5,保密,我打第一把绝密航天全是m250和6套，我自己穿着四套被揍成二臂了，然后就再也不打了，航天都不去了[doge],2025-03-30 06:43:50,0,0,带螺旋桨的没有浮木,未知,否,https://i0.hdslb.com/bfs/face/f18b7432d8c3d39cfb404873752a11322de25c77.jpg
74,0,259068968736,3546609426106746,夏凉夏之池,3,保密,我觉得上头的不是绝命航天，像我这样飞的人爆率其实也就那样上头的是全装，你打谁都不虚，而且你能匹配到的也都是这一水平的，你这是技术好不好不重要，重要的是那里面的每一个人都是行走的非洲之心我第一次打全装的时候，匹配到的三个队伍全都是六套，最后灭掉两队，然后死了，可是那种感觉忘不了啊，所以仓库越打越空了，正常打，你是怎么都回不了本儿的？但是你真全装对面也是你拿一个红头就多少钱了？枪里塞的金蛋满改的枪，无论输我亏多少，得吃一把我就多少了，子弹钱也有了，枪改装钱也有了，至于甲一个高级咖啡豆，打多了总能摸到吧？当在机密里面跑到摸到一个高级咖啡豆的时候，我就知道，我又得去那个是非之地了,2025-03-30 05:00:07,0,1,,未知,否,https://i0.hdslb.com/bfs/face/b9d421dd58f79c5fdafc9ffde0db86a2d33a840c.jpg
75,0,258241206321,3494374042241591,一只路过的肝帝,5,保密,如果觉得三角洲爆率不够的话，可以去玩暗区玩一周，然后再回三角洲，起码能带来一点心理安慰,2025-03-30 04:43:29,0,0,你好鸭！,未知,否,https://i2.hdslb.com/bfs/face/3ddcd7ddbc3732cacd0ebd564a10ad2e8a7ee4b5.jpg
76,0,259064667552,1299912036,Keven刚下凡,5,保密,主要是我进航天基地，一把也才摸到90多w啊[笑哭],2025-03-30 04:15:03,0,1,海阔凭鱼跃，天高任鸟飞,未知,否,https://i0.hdslb.com/bfs/face/3e48ae4eb8ea1360290dc1b0e07405800eee1c67.jpg
77,0,258235055137,34892070,紫龙菌,6,保密,航天出油之后就懒得去了，就偶尔盾哥单三去浮力当神秘肘击男玩一玩[脱单doge],2025-03-30 03:31:13,0,0,立志整出最创的活，目前主攻碧蓝档案二创，但是可能会做些其他的(≧▽≦),未知,否,https://i0.hdslb.com/bfs/face/5b895e6c2d39f42ba5208eb29da4049e7b089e5f.jpg
78,0,259060439056,96757128,秋落木_,6,保密,绝密的精髓，要么战斗爽。要么出货[吃瓜],2025-03-30 03:26:32,0,0,笑靥如花谈笑风生的脸上，有谁能看出谁内心的凄苦与忧伤。,未知,是,https://i0.hdslb.com/bfs/face/a4e6bceca72618718ab2cd22cc33da07910f20ba.jpg
79,0,259050954400,452280947,混沌教派-索总,5,保密,"航天赚钱航天花，一分别想带回家。
500w撤离回仓库一看300w假账+200w战损[doge]",2025-03-30 01:14:16,0,0,我也想有国服,未知,否,https://i2.hdslb.com/bfs/face/f6c1a0270ba4a5618abff11a8ea3f0bac395350c.jpg
80,0,259045315712,1462818908,狠狠的剪,2,保密,这狗几把模式太逆天了。普通的全是人机。一点意思没有。困难的没配合根本打不了。各种脚步声，有人机的有真人的不注意背后就一枪。要么就别出去。。这特么是人玩的？,2025-03-29 22:34:33,0,0,想要火柴吗,未知,否,https://i2.hdslb.com/bfs/face/50dc4292b71acb827c48f61a39cf6b2bdfc69ef0.jpg
81,0,259043832720,104240043,VC噬魂,6,男,为啥我玩绝密遇到的全是高强度或神人局啊，我也不是什么高手啊，打完一队来一队，一个浮力接了四个队，根本打不过。现在掉kd本来1.6kd我硬掉到0.29养成唐人，结果还是高强度，黑室打个人机开了一枪都能来四个队打架，接飞升跑路都能来四个队，不是我们就必须死（四）呗，神人牢位，最后十分钟我们接飞升，桥下来了两队，牢位没开桥有一队乌鲁鲁在牢位狙我们开大炸我们，最无敌的是好不容易打完就我朋友一个活着趁着两队打起来跑去开电脑，还有一队蹲在飞升接任务的地方真无敌了，桥上还在打，这时候两个闸都没拉，飞升也不是十二分的他们真就全是神人没一个想走的,2025-03-29 20:40:01,0,0,我愿用看这条信息人的一生单身换我脸白。,未知,否,https://i0.hdslb.com/bfs/face/1e90ab3092dc4591bff5ccb32a66302197e4faf9.jpg
82,0,258204239345,352094952,芝士皮泽尔pizzelle,4,男,我的垃圾手机老是会胜利,2025-03-29 15:16:55,0,0,"你看你妈呢，我是屁股儿。

QQ号：3690657585

微信号：pzlpizza

QQ群：996777599",未知,否,https://i0.hdslb.com/bfs/face/5db4eb9b7acfca2f606fdd472bd816032f569958.jpg
83,0,258204260193,393773185,小博在补考,5,男,机密都打不过[微笑],2025-03-29 15:15:04,0,1,,未知,否,https://i1.hdslb.com/bfs/face/69d821fc1203c8a7b75f9aab8c59c50d03de582e.jpg
84,0,259028672080,188927814,正在减肥的猪猪侠,5,保密,兄弟们 4套半改三单枪去普坝是真的爽有股六套打仙丹的感觉[妙啊],2025-03-29 15:13:39,0,0,,未知,是,https://i0.hdslb.com/bfs/face/79cbab189b7eac195c31593c212cb7eb289afe2c.jpg
85,0,259018470400,3546756434365045,w4骚年,3,保密,巴克什什博物馆出的被两个五直接拷打[doge],2025-03-29 13:21:51,0,0,,未知,是,https://i0.hdslb.com/bfs/face/member/noface.jpg
86,0,259009271632,39874220,超大胆就是我,5,保密,普坝现在多少4套知道吗？,2025-03-29 11:35:39,0,0,,未知,否,https://i2.hdslb.com/bfs/face/eb58f347d560732b545cbee17557429fb9a43f9f.jpg
87,0,258182663329,1178592990,王大虫猫猫敌无,4,女,新手第一天玩了不到10把出了这个,2025-03-29 11:03:16,0,1,.,未知,否,https://i0.hdslb.com/bfs/face/a529633e5f0ac4853bfa7e22b623cab19e096367.jpg
88,0,259003349616,630793746,一轮斜月映残花,5,保密,不得不给你们看看我普坝出的……,2025-03-29 10:30:23,0,1,,未知,否,https://i0.hdslb.com/bfs/face/36f4fd62baa36bac745d782ce05265dbe391a9f3.jpg
89,0,259003095152,3537119307893403,ulb-sans___,3,保密,我航天地图都没下[笑哭],2025-03-29 10:26:44,0,0,这边是懒得改名字不是云玩家,未知,否,https://i0.hdslb.com/bfs/face/32dfb62bfa6b5f969bcc671833302e8b74226feb.jpg
90,0,258993327200,94884922,芝士牛奶zzz,6,保密,打的45w卡战备吃了她妈的800w我那一刻人已经升华了,2025-03-29 08:27:30,0,0,该用户已被封禁～,未知,否,https://i1.hdslb.com/bfs/face/dabc851d46477d34bdc96989b092bbbde036dff1.jpg
